{"meta":{"id":"bw_edge_7479856c6d05a882","schemaVersion":"boreal.runtime.v1","createdAt":"2026-07-02T03:38:32.918Z","updatedAt":"2026-07-02T03:38:32.918Z","createdBy":{"id":"cybertron","kind":"human","displayName":"cybertron"},"updatedBy":{"id":"cybertron","kind":"human","displayName":"cybertron"},"sourceRefs":[],"tags":[],"contentHash":"sha256:844c28eabedd65c431cd1f22252e2a09abd0b7d829a43a0a269f3a443311a5ae"},"kind":"blocks","fromId":"bw_work_51a4e68e4d3ca9d5","fromType":"work","toId":"bw_work_82217510ab7a36db","toType":"work","directed":true}
