{"meta":{"id":"bw_edge_11948b40d4885087","schemaVersion":"boreal.runtime.v1","createdAt":"2026-07-10T17:09:56.453Z","updatedAt":"2026-07-10T17:09:56.453Z","createdBy":{"id":"cybertron","kind":"human","displayName":"cybertron"},"updatedBy":{"id":"cybertron","kind":"human","displayName":"cybertron"},"sourceRefs":[],"tags":[],"contentHash":"sha256:31fcf7d2e941ef065a5b5ce6dc28235ad87db75d30007832736373550eea119f"},"kind":"blocks","fromId":"bw_work_2d916951b65bd885","fromType":"work","toId":"bw_work_1adeda1a3c7867ff","toType":"work","directed":true}
