{"meta":{"id":"bw_edge_18c496d9cb62ed12","schemaVersion":"boreal.runtime.v1","createdAt":"2026-07-01T03:31:32.250Z","updatedAt":"2026-07-01T03:31:32.250Z","createdBy":{"id":"cybertron","kind":"human","displayName":"cybertron"},"updatedBy":{"id":"cybertron","kind":"human","displayName":"cybertron"},"sourceRefs":[],"tags":[],"contentHash":"sha256:935c38024c83692373f07c2eb8d6b3fd97d2b0e0484a4cba07d252aee82dfed0"},"kind":"blocks","fromId":"bw_work_759dacd2c62727ad","fromType":"work","toId":"bw_work_beca72d119df641e","toType":"work","directed":true}
