{"meta":{"id":"bw_edge_4d54b238f29d3743","schemaVersion":"boreal.runtime.v1","createdAt":"2026-07-03T20:45:39.295Z","updatedAt":"2026-07-03T20:45:39.295Z","createdBy":{"id":"cybertron","kind":"human","displayName":"cybertron"},"updatedBy":{"id":"cybertron","kind":"human","displayName":"cybertron"},"sourceRefs":[],"tags":[],"contentHash":"sha256:99b54d81280495873bbbffc87bca13e3dc41194bc9ab8535f8e1e41f2fb83686"},"kind":"blocks","fromId":"bw_work_955684b17c4a9349","fromType":"work","toId":"bw_work_bbd34b7ef6f302d8","toType":"work","directed":true}
