{"meta":{"id":"bw_edge_2c7a1f8a3f1742ab","schemaVersion":"boreal.runtime.v1","createdAt":"2026-06-27T01:11:43.140Z","updatedAt":"2026-06-27T01:11:43.140Z","createdBy":{"id":"codex-v1-planner","kind":"agent","displayName":"codex-v1-planner"},"updatedBy":{"id":"codex-v1-planner","kind":"agent","displayName":"codex-v1-planner"},"sourceRefs":[],"tags":[],"contentHash":"sha256:4359af696a9cbf7d6660c513248e3fbd3987cca18f92426c2a88b5c530940ed1"},"kind":"blocks","fromId":"bw_work_982454b209365350","fromType":"work","toId":"bw_work_d74272673c86d4fd","toType":"work","directed":true}
