{"meta":{"id":"bw_edge_713ddfff6d650af3","schemaVersion":"boreal.runtime.v1","createdAt":"2026-07-10T17:09:02.190Z","updatedAt":"2026-07-10T17:09:02.190Z","createdBy":{"id":"cybertron","kind":"human","displayName":"cybertron"},"updatedBy":{"id":"cybertron","kind":"human","displayName":"cybertron"},"sourceRefs":[],"tags":[],"contentHash":"sha256:63e80dd5b19710e4d85958d64126cdda2d72c11f63fc392b9f7b3ad2f54b2fe6"},"kind":"blocks","fromId":"bw_work_29d42bc1d609c59d","fromType":"work","toId":"bw_work_802a3a492fd7462a","toType":"work","directed":true}
