{"meta":{"id":"bw_edge_5b1b161dc2e48f84","schemaVersion":"boreal.runtime.v1","createdAt":"2026-07-10T17:10:21.633Z","updatedAt":"2026-07-10T17:10:21.633Z","createdBy":{"id":"cybertron","kind":"human","displayName":"cybertron"},"updatedBy":{"id":"cybertron","kind":"human","displayName":"cybertron"},"sourceRefs":[],"tags":[],"contentHash":"sha256:d706b695ee5d7380fa7134cd868105ae5ea1bd77c7eb2a76b4b134d61a340eeb"},"kind":"blocks","fromId":"bw_work_c4d90b8db56fa21e","fromType":"work","toId":"bw_work_802a3a492fd7462a","toType":"work","directed":true}
