{"meta":{"id":"bw_edge_246a3ad19353c2df","schemaVersion":"boreal.runtime.v1","createdAt":"2026-07-07T14:23:14.255Z","updatedAt":"2026-07-07T14:23:14.255Z","createdBy":{"id":"cybertron","kind":"human","displayName":"cybertron"},"updatedBy":{"id":"cybertron","kind":"human","displayName":"cybertron"},"sourceRefs":[],"tags":[],"contentHash":"sha256:f02f793182de832c92abc72f83b11097b0f48dc9cf76a1caa3a2ac9f06cd4a3b"},"kind":"blocks","fromId":"bw_work_bdff86f90fc97c59","fromType":"work","toId":"bw_work_3695a3716234e67a","toType":"work","directed":true}
