{"meta":{"id":"bw_edge_92f5c8e190a0f5ee","schemaVersion":"boreal.runtime.v1","createdAt":"2026-07-01T03:30:14.471Z","updatedAt":"2026-07-01T03:30:14.471Z","createdBy":{"id":"cybertron","kind":"human","displayName":"cybertron"},"updatedBy":{"id":"cybertron","kind":"human","displayName":"cybertron"},"sourceRefs":[],"tags":[],"contentHash":"sha256:d8f6cf76199e9df76cdeaf4e809a8d0f57a76f51cdd97c566fb5ce65bf5fe5ba"},"kind":"blocks","fromId":"bw_work_d79d7793898f4dc4","fromType":"work","toId":"bw_work_3532e08164c759e6","toType":"work","directed":true}
