{"meta":{"id":"bw_edge_bc17c35b00b17d38","schemaVersion":"boreal.runtime.v1","createdAt":"2026-06-27T01:11:29.812Z","updatedAt":"2026-06-27T01:11:29.812Z","createdBy":{"id":"codex-v1-planner","kind":"agent","displayName":"codex-v1-planner"},"updatedBy":{"id":"codex-v1-planner","kind":"agent","displayName":"codex-v1-planner"},"sourceRefs":[],"tags":[],"contentHash":"sha256:e0cb7f94f6d8e31b593d9cf42532d55268e5ede5e4d600c6b173d977f49a4cba"},"kind":"blocks","fromId":"bw_work_2d3c8a10e491c2b8","fromType":"work","toId":"bw_work_a159117052d5ee40","toType":"work","directed":true}
