{"meta":{"id":"bw_edge_4bfb66f614bf3c57","schemaVersion":"boreal.runtime.v1","createdAt":"2026-07-03T03:43:57.394Z","updatedAt":"2026-07-03T03:43:57.394Z","createdBy":{"id":"cybertron","kind":"human","displayName":"cybertron"},"updatedBy":{"id":"cybertron","kind":"human","displayName":"cybertron"},"sourceRefs":[],"tags":[],"contentHash":"sha256:e5d40c6a53b8f8e3f933c9ef21457d51456f16773c01b1409f1a52e4a13ede77"},"kind":"blocks","fromId":"bw_work_8e38487249e3c3c7","fromType":"work","toId":"bw_work_9a961b516478adae","toType":"work","directed":true}
