{"meta":{"id":"bw_edge_144298ea4f472e80","schemaVersion":"boreal.runtime.v1","createdAt":"2026-07-10T17:09:53.904Z","updatedAt":"2026-07-10T17:09:53.904Z","createdBy":{"id":"cybertron","kind":"human","displayName":"cybertron"},"updatedBy":{"id":"cybertron","kind":"human","displayName":"cybertron"},"sourceRefs":[],"tags":[],"contentHash":"sha256:9a33cc0d35f90e5d8c921bedee5927c03b5b19fd5500dbae983d061c7519c58f"},"kind":"blocks","fromId":"bw_work_308534e1ff80988e","fromType":"work","toId":"bw_work_29d42bc1d609c59d","toType":"work","directed":true}
