{"meta":{"id":"bw_edge_04e8284bd340e7dd","schemaVersion":"boreal.runtime.v1","createdAt":"2026-07-10T17:08:35.505Z","updatedAt":"2026-07-10T17:08:35.505Z","createdBy":{"id":"cybertron","kind":"human","displayName":"cybertron"},"updatedBy":{"id":"cybertron","kind":"human","displayName":"cybertron"},"sourceRefs":[],"tags":[],"contentHash":"sha256:d59dadda226ee39680a1626aa36bebebb4867556149663aea24644d99e7b86ee"},"kind":"blocks","fromId":"bw_work_7a38f0a77aa2d69d","fromType":"work","toId":"bw_work_c2fc1310c64c5c17","toType":"work","directed":true}
