{"meta":{"id":"bw_edge_d659bc640a2d4cc2","schemaVersion":"boreal.runtime.v1","createdAt":"2026-07-02T17:18:31.227Z","updatedAt":"2026-07-02T17:18:31.227Z","createdBy":{"id":"cybertron","kind":"human","displayName":"cybertron"},"updatedBy":{"id":"cybertron","kind":"human","displayName":"cybertron"},"sourceRefs":[],"tags":[],"contentHash":"sha256:d1e86692225465674e9e206166d152e30e9cf40b58abd1d13e37c8852155382f"},"kind":"blocks","fromId":"bw_work_9940c6168ebfb499","fromType":"work","toId":"bw_work_1daaf2f27b5fd255","toType":"work","directed":true}
