{"meta":{"id":"bw_edge_459c6eec7e14a26f","schemaVersion":"boreal.runtime.v1","createdAt":"2026-07-07T15:03:45.484Z","updatedAt":"2026-07-07T15:03:45.484Z","createdBy":{"id":"cybertron","kind":"human","displayName":"cybertron"},"updatedBy":{"id":"cybertron","kind":"human","displayName":"cybertron"},"sourceRefs":[],"tags":[],"contentHash":"sha256:c1508280a5a44f7a6778ef0a2a3065bf7cf362cb0ede95340f81af45260ab1e7"},"kind":"blocks","fromId":"bw_work_608a261817b6c8b5","fromType":"work","toId":"bw_work_3695a3716234e67a","toType":"work","directed":true}
