{"meta":{"id":"bw_edge_6ba114ea2fc887e8","schemaVersion":"boreal.runtime.v1","createdAt":"2026-06-27T01:50:41.307Z","updatedAt":"2026-06-27T01:50:41.307Z","createdBy":{"id":"cybertron","kind":"human","displayName":"cybertron"},"updatedBy":{"id":"cybertron","kind":"human","displayName":"cybertron"},"sourceRefs":[],"tags":[],"contentHash":"sha256:e8708952bca308657c7f7dfcafb3f85b1feba62d4486db4aa6571851b492ad9b"},"kind":"blocks","fromId":"bw_work_2fa49e8300b51cd3","fromType":"work","toId":"bw_work_3ab760fe568426d9","toType":"work","directed":true}
