{"meta":{"id":"bw_edge_877aaa6005c39560","schemaVersion":"boreal.runtime.v1","createdAt":"2026-07-02T21:53:31.947Z","updatedAt":"2026-07-02T21:53:31.947Z","createdBy":{"id":"cybertron","kind":"human","displayName":"cybertron"},"updatedBy":{"id":"cybertron","kind":"human","displayName":"cybertron"},"sourceRefs":[],"tags":[],"contentHash":"sha256:8171819a7ec3cacf69c0a0634be8e1d13f8e768270c6749cdc3222e1352273f6"},"kind":"blocks","fromId":"bw_work_166a035030c4df5d","fromType":"work","toId":"bw_work_47ba02626578872b","toType":"work","directed":true}
