{"meta":{"id":"bw_edge_bae0b469948e3b72","schemaVersion":"boreal.runtime.v1","createdAt":"2026-07-03T20:46:02.293Z","updatedAt":"2026-07-03T20:46:02.293Z","createdBy":{"id":"cybertron","kind":"human","displayName":"cybertron"},"updatedBy":{"id":"cybertron","kind":"human","displayName":"cybertron"},"sourceRefs":[],"tags":[],"contentHash":"sha256:8ec5488587c3d7572a145e7811810b9c8afed9906cd2f55ac040a3ae6c9adb6f"},"kind":"blocks","fromId":"bw_work_f14baaa786e881c4","fromType":"work","toId":"bw_work_9ef6934194be3516","toType":"work","directed":true}
