{"meta":{"id":"bw_edge_d83c82aeac0c5ec8","schemaVersion":"boreal.runtime.v1","createdAt":"2026-07-02T17:18:55.747Z","updatedAt":"2026-07-02T17:18:55.747Z","createdBy":{"id":"cybertron","kind":"human","displayName":"cybertron"},"updatedBy":{"id":"cybertron","kind":"human","displayName":"cybertron"},"sourceRefs":[],"tags":[],"contentHash":"sha256:d647e4d4e3f70f389829c185642c06989939fa52c89b3c45cbb062ba050822a7"},"kind":"blocks","fromId":"bw_work_b3d8000fb9705638","fromType":"work","toId":"bw_work_d7c2883646b67b89","toType":"work","directed":true}
