{"meta":{"id":"bw_edge_c9a3437c691414cb","schemaVersion":"boreal.runtime.v1","createdAt":"2026-06-27T01:11:05.235Z","updatedAt":"2026-06-27T01:11:05.235Z","createdBy":{"id":"codex-v1-planner","kind":"agent","displayName":"codex-v1-planner"},"updatedBy":{"id":"codex-v1-planner","kind":"agent","displayName":"codex-v1-planner"},"sourceRefs":[],"tags":[],"contentHash":"sha256:85a1b8ce47d7f00f3028b48fcafccd964bca791984708d3da6804e5d8ed29ea8"},"kind":"blocks","fromId":"bw_work_8b936d89babd0334","fromType":"work","toId":"bw_work_60459710b0455152","toType":"work","directed":true}
