{"meta":{"id":"bw_edge_cd9cef40b0054d5c","schemaVersion":"boreal.runtime.v1","createdAt":"2026-07-02T17:19:20.609Z","updatedAt":"2026-07-02T17:19:20.609Z","createdBy":{"id":"cybertron","kind":"human","displayName":"cybertron"},"updatedBy":{"id":"cybertron","kind":"human","displayName":"cybertron"},"sourceRefs":[],"tags":[],"contentHash":"sha256:25d42c803984def9f80703f264db0dafab0fd4456dddf868d4558494f26230e8"},"kind":"blocks","fromId":"bw_work_069d81450ec2a601","fromType":"work","toId":"bw_work_cda240cb14c33d2a","toType":"work","directed":true}
