{"meta":{"id":"bw_edge_ada1865134f11f2f","schemaVersion":"boreal.runtime.v1","createdAt":"2026-06-27T14:33:14.148Z","updatedAt":"2026-06-27T14:33:14.148Z","createdBy":{"id":"cybertron","kind":"human","displayName":"cybertron"},"updatedBy":{"id":"cybertron","kind":"human","displayName":"cybertron"},"sourceRefs":[],"tags":[],"contentHash":"sha256:4420c4bccfcc497be1d4ea13169131bba947d838a347f052c9e80b95934a87b4"},"kind":"blocks","fromId":"bw_work_e26e3751f058721d","fromType":"work","toId":"bw_work_ad05324b7dc0ace9","toType":"work","directed":true}
