{"meta":{"id":"bw_edge_96987a2d90c96efe","schemaVersion":"boreal.runtime.v1","createdAt":"2026-07-01T03:30:15.606Z","updatedAt":"2026-07-01T03:30:15.606Z","createdBy":{"id":"cybertron","kind":"human","displayName":"cybertron"},"updatedBy":{"id":"cybertron","kind":"human","displayName":"cybertron"},"sourceRefs":[],"tags":[],"contentHash":"sha256:ef3b30b9b414325809b2b10f365a2a7e8bf7a5ac8b53271ffd7f1d4ad8b448cd"},"kind":"blocks","fromId":"bw_work_beca72d119df641e","fromType":"work","toId":"bw_work_3532e08164c759e6","toType":"work","directed":true}
