{"meta":{"id":"bw_edge_d7c70880f8060176","schemaVersion":"boreal.runtime.v1","createdAt":"2026-07-02T03:39:13.809Z","updatedAt":"2026-07-02T03:39:13.809Z","createdBy":{"id":"cybertron","kind":"human","displayName":"cybertron"},"updatedBy":{"id":"cybertron","kind":"human","displayName":"cybertron"},"sourceRefs":[],"tags":[],"contentHash":"sha256:1e4e29f0eee85fa61b7c00f8f8d014a34ff4e633743cad2067beded5c5f173da"},"kind":"blocks","fromId":"bw_work_ccc70ee2cd6d077e","fromType":"work","toId":"bw_work_83d26ba4b699e252","toType":"work","directed":true}
